[
  {
    "id": "ast-based-repo-map",
    "type": "feature",
    "status": "completed",
    "version": 1,
    "author": "sanmak",
    "updated": "2026-03-14T18:37:08Z"
  },
  {
    "id": "bugfix-regression-analysis",
    "type": "feature",
    "status": "completed",
    "version": 1,
    "author": "sanmak",
    "updated": "2026-03-08T03:12:30Z"
  },
  {
    "id": "drift-detection",
    "type": "feature",
    "status": "completed",
    "version": 1,
    "author": "sanmak",
    "updated": "2026-03-08T09:36:18Z"
  },
  {
    "id": "ears-notation",
    "type": "feature",
    "status": "completed",
    "version": 1,
    "author": "sanmak",
    "updated": "2026-03-07T12:30:00Z"
  },
  {
    "id": "enforcement-roadmap",
    "type": "feature",
    "status": "completed",
    "version": 1,
    "author": "sanmak",
    "updated": "2026-03-18T20:22:30Z"
  },
  {
    "id": "install-integrity-verification",
    "type": "feature",
    "status": "completed",
    "version": 1,
    "author": "sanmak",
    "updated": "2026-03-18T19:25:39Z"
  },
  {
    "id": "local-memory-layer",
    "type": "feature",
    "status": "completed",
    "version": 1,
    "author": "sanmak",
    "updated": "2026-03-14T09:28:58Z"
  },
  {
    "id": "plan-to-specops-automation",
    "type": "feature",
    "status": "completed",
    "version": 1,
    "author": "sanmak",
    "updated": "2026-03-18T21:04:29Z"
  },
  {
    "id": "project-type-awareness",
    "type": "feature",
    "status": "completed",
    "version": 1,
    "author": "sanmak",
    "updated": "2026-03-20T19:36:02Z"
  },
  {
    "id": "proxy-metrics",
    "type": "feature",
    "status": "completed",
    "version": 1,
    "author": "sanmak",
    "updated": "2026-03-20T20:03:10Z"
  },
  {
    "id": "rich-issue-bodies",
    "type": "feature",
    "status": "completed",
    "version": 1,
    "author": "sanmak",
    "updated": "2026-03-21T04:52:53Z"
  },
  {
    "id": "steering-files",
    "type": "feature",
    "status": "completed",
    "version": 1,
    "author": "sanmak",
    "updated": "2026-03-08T06:46:57Z"
  },
  {
    "id": "task-delegation",
    "type": "feature",
    "status": "completed",
    "version": 1,
    "author": "sanmak",
    "updated": "2026-03-18T02:34:12Z"
  },
  {
    "id": "workflow-automation-suite",
    "type": "feature",
    "status": "completed",
    "version": 1,
    "author": "sanmak",
    "updated": "2026-03-21T03:31:46Z"
  },
  {
    "id": "workflow-enforcement-gates",
    "type": "feature",
    "status": "completed",
    "version": 1,
    "author": "sanmak",
    "updated": "2026-03-18T19:25:39Z"
  },
  {
    "id": "writing-quality-rules",
    "type": "feature",
    "status": "completed",
    "version": 1,
    "author": "sanmak",
    "updated": "2026-03-20T17:09:13Z"
  }
]
